{
  "client_id": "gt-engineering",
  "asset_under_test": "공식 회사소개서 목차, 홈페이지 콘텐츠 구조안, 로고 작업 범위표",
  "before_state": [
    "기존 브로셔와 홈페이지가 있으나 공식 외부 제출용 기준이 명확하지 않다.",
    "홈페이지에 더미 데이터가 남아 있어 고객, 제휴사, 투자자, 관공서/입찰 담당자에게 바로 보여주기 어렵다.",
    "전체 제작비를 확정하기 전에 페이지 수, 자료 상태, 콘텐츠 작성 범위가 흔들린다."
  ],
  "after_state": [
    "회사소개서 목차와 우선 페이지가 정리된다.",
    "홈페이지에서 실제 콘텐츠로 교체해야 할 페이지와 제외할 페이지가 분리된다.",
    "로고/CI 작업 범위가 유지, 리터칭, 변경 중 하나로 판단된다.",
    "본 제작 견적 산정에 필요한 자료와 추가비 조건이 명확해진다."
  ],
  "thirty_day_signals": [
    "대표 또는 의사결정자가 회사소개서 목차를 기준으로 본 제작 여부를 결정한다.",
    "홈페이지 우선 마감 페이지가 확정되고 필요한 자료가 전달된다.",
    "영업, 제휴, 입찰 대화에서 새 구조안이 설명 자료로 사용된다.",
    "본 제작 견적이 가격 분쟁 없이 다음 단계로 검토된다."
  ],
  "evidence_to_collect": [
    "고객이 승인한 회사소개서 목차",
    "고객이 승인한 홈페이지 우선 마감 페이지 목록",
    "고객이 제공한 프로젝트/인증/사진 자료 목록",
    "본 제작 전환 여부와 결정 사유",
    "30일 안에 실제 외부 미팅 또는 입찰/제휴 대화에 사용된 사례"
  ],
  "follow_up_questions": [
    "1차 착수 산출물 중 실제로 의사결정에 도움이 된 것은 무엇인가요?",
    "아직 판단이 막히는 자료나 페이지는 무엇인가요?",
    "30일 안에 외부에 보여준 대상은 누구였나요?",
    "본 제작으로 넘어갈 때 가장 먼저 완성해야 할 자산은 무엇인가요?"
  ],
  "retainer_bridge": [
    "홈페이지 업데이트와 프로젝트 사례 정리가 반복되면 월간 콘텐츠 운영으로 제안한다.",
    "입찰/제휴 자료가 반복적으로 필요하면 회사소개서와 영업 자료 개선 운영으로 제안한다.",
    "프로젝트 사진, 인증, 실적 관리가 누적되면 브랜드 자료실 운영으로 제안한다."
  ],
  "stop_conditions": [
    "고객이 필수 자료를 제공하지 않아 본 제작 범위를 확정할 수 없는 경우",
    "로고/CI 전면 변경으로 전환되었지만 별도 예산을 확정하지 않는 경우",
    "1차 착수 산출물이 실제 의사결정이나 외부 사용으로 이어지지 않는 경우"
  ]
}
